Dracula Densetsu II japonés Nintendo Game Boy Juego Completo;126,91 EUR;+ 16,92 EUR de envío;desde Alemania;
✨ Dracula Densetsu II Castlevania II Game Boy 1991 Nintendo Boxed GB DMG-CWJ ✨;139,00 EUR;+ 28,10 EUR de envío;desde Francia;
Castlevania 2-Dracula Densetsu II para Nintendo Gameboy, Importación de Japón -;76,05 EUR;Envío no especificado;desde República Checa;
Dracula Densetsu II (Castlevania II: Belmont's Revenge) Nintendo Game Boy jp F/S;24,75 EUR;Envío internacional gratis;desde Japón;
Nintendo Game Boy Dracula Densetsu II Importado De Japón -;66,16 EUR;+ 16,92 EUR de envío;desde Japón;
Dracula Densetsu II (Castlevania II) (Nintendo Gameboy Game Boy)-No Manual ;56,85 EUR;+ 4,01 EUR de envío;desde Canadá;
Dracula Densetsu II/CASTLEVANIA II GB Game Boy probado Cartucho Caja de Japón;109,99 EUR;Envío internacional gratis;desde Japón;
