Game Boy Hunt for Red October PAL Italia ORIGINAL gameboy Nintendo genuine MINT;12,76 EUR;+ 2,50 EUR de envío;Vendidos  8 sep 2021Artículo vendido;desde España;
Gameboy: the Hunt for Red October. promotion 4 th 4 Free;5,99 EUR;+ 19,99 EUR de envío;Vendidos  5 sep 2021Artículo vendido;desde Países Bajos;
Game Boy juego the Hunt for Red October con embalaje original y guía. top estado;35,00 EUR;Envío no especificado;Vendidos  24 jun 2021Artículo vendido;desde Alemania;
Hunt for Red October Gameboy Game Boy gb Classic OVP EE. UU. en blanco de embalaje;39,90 EUR;Envío no especificado;Vendidos  20 jun 2021Artículo vendido;desde Alemania;
The Hunt for Red October [Blu-ray] [1990] [Region Free] [DVD][Region 2];9,37 EUR;+ 2,34 EUR de envío;Vendidos  10 sep 2021Artículo vendido;desde Reino Unido;
The Hunt for Red October - Special Collector's Edition (Sean Connery);4,08 EUR;+ 16,50 EUR de envío estimado;Vendidos  27 jul 2021Artículo vendido;desde Reino Unido;
Sum of all Fears/Patriot Games/Hunt for Red October/Clear and Present Danger DVD;17,54 EUR;+ 16,74 EUR de envío estimado;Vendidos  7 sep 2021Artículo vendido;desde Reino Unido;
The Hunt for Red October [Blu-ray] [1990] [Region Free], , Used; Very Good Blu-r;4,20 EUR;+ 2,15 EUR de envío;Vendidos  26 ago 2021Artículo vendido;desde Reino Unido;
The Hunt for Red October (1990) - DVD - Sean Connery, Alec Baldwin;4,67 EUR;+ 16,51 EUR de envío estimado;Vendidos  29 jul 2021Artículo vendido;desde Reino Unido;
Tom Clancy Box Set (The Hunt for Red October, Patriot Games, Clear and Present D;8,78 EUR;+ 21,08 EUR de envío estimado;Vendidos  6 jul 2021Artículo vendido;desde Reino Unido;
Notice Nintendo NES The Hunt for Red October FRA Très Bon état;19,90 EUR;+ 11,98 EUR de envío;Vendidos  6 sep 2021Artículo vendido;desde Francia;
