Nintendo Gameboy juego módulo Attack of the Killer Tomatoes DMG-ak-noe g251;25,00 EUR;+ 6,60 EUR de envío;desde Alemania;
!!! Nintendo Game Boy instrucciones Attack of the Killer Tomatoes bien!!!;29,99 EUR;+ 9,00 EUR de envío;desde Alemania;
Attack of the Killer Tomatoes - Gameboy Classic - NOE excl - GB CIB near MINT;1.199,99 EUR;+ 18,60 EUR de envío;desde Bélgica;
Nes Nintendo, Attack of the Killer Tomatoes-Embalaje original-pal germano-Top;189,90 EUR;+ 15,90 EUR de envío;desde Alemania;
Nintendo Entertainment System nes juego módulo Attack of the Killer Tomatoes;36,00 EUR;+ 6,60 EUR de envío;desde Alemania;
Attack of the Killer Tomatoes nes juego sólo el módulo;39,99 EUR;+ 4,00 EUR de envío;desde Alemania;
Attack of the Killer Tomatoes nes juego sólo el módulo;39,99 EUR;+ 4,00 EUR de envío;desde Alemania;
Attack of the Killer Tomatoes para Nintendo NES;38,99 EUR;+ 5,99 EUR de envío;desde Alemania;
Attack of the Killer Tomatoes nes juego sólo el módulo;39,99 EUR;+ 4,00 EUR de envío;desde Alemania;
Attack of the Killer Tomatoes, guía, Nintendo NES juego;69,99 EUR;+ 5,90 EUR de envío;desde Alemania;
Nes-Attack of the Killer Tomatoes para Nintendo NES;39,95 EUR;+ 6,50 EUR de envío;desde Alemania;
Nintendo NES Attack of the Killer Tomatoes FRA Très Bon état;29,90 EUR;+ 9,98 EUR de envío;desde Francia;
