Casi nuevo, sin usar Gameboy dmg Milon's Secret Castle CARTUCHO USA;14,63 EUR;Envío no especificado;Vendidos  24 ago 2021Artículo vendido;desde Reino Unido;
Nintendo Game Boy Milon's Secret Castle USA Bon état;14,90 EUR;+ 11,98 EUR de envío;Vendidos  12 jul 2021Artículo vendido;desde Francia;
Milon's Secret Castle Game Boy Raro Folleto De Instrucciones Manual DMG-M8-USA;16,90 EUR;Envío gratis;Vendidos  11 sep 2021Artículo vendido;desde Estados Unidos;
Milon's Secret Castle Nintendo Game Boy Juego y Caja ~ probado y de trabajo;50,77 EUR;+ 3,60 EUR de envío;Vendidos  9 sep 2021Artículo vendido;desde Estados Unidos;
Milon's Secret Castle Nintendo Game Boy Juego Y Manual ~ probado y de trabajo;38,07 EUR;+ 3,77 EUR de envío;Vendidos  1 sep 2021Artículo vendido;desde Estados Unidos;
Nintendo GAME BOY SOLO Manual Milon's Secret Castle;15,23 EUR;+ 2,54 EUR de envío;Vendidos  4 ago 2021Artículo vendido;desde Estados Unidos;
Milon's Secret Castle (Nintendo Gameboy Original) [Complete in Box CIB];80,27 EUR;+ 7,99 EUR de envío;Vendidos  26 jul 2021Artículo vendido;desde Canadá;
1993 Nintendo Gameboy Milon's Secret Castle, Caja solamente, sin caja de carro, crujiente;60,07 EUR;+ 7,45 EUR de envío;Vendidos  21 jul 2021Artículo vendido;desde Estados Unidos;
Milon's Secret Castle (Nintendo Game Boy);16,82 EUR;Envío gratis;Vendidos  16 jul 2021Artículo vendido;desde Estados Unidos;
Milon's Secret Castle Juego Boy juego;98,57 EUR;Envío gratis;Vendidos  22 jun 2021Artículo vendido;desde Estados Unidos;
Milon's Secret Castle;15,15 EUR;+ 3,33 EUR de envío;Vendidos  8 sep 2021Artículo vendido;desde Reino Unido;
