Micro Machines 1 & 2 Twin Turbo Game Boy Color Cartucho sólo 1998 en muy buena condición Libre P&P;9,95 EUR;+ 16,60 EUR de envío estimado;Vendidos  8 sep 2021Artículo vendido;desde Reino Unido;
Micro Machines Game Boy USA ;9,00 EUR;Envío internacional gratis;Vendidos  26 ago 2021Artículo vendido;desde Francia;
Game Boy Color en Caja Juego Micro Machines 1 y 2 Twin Turbo;15,20 EUR;+ 20,44 EUR de envío estimado;Vendidos  21 ago 2021Artículo vendido;desde Reino Unido;
Micro Machines V3 para Nintendo Gameboy Color En Caja;21,00 EUR;+ 16,80 EUR de envío estimado;Vendidos  18 ago 2021Artículo vendido;desde Reino Unido;
Micro Machines 1 y 2 Twin Turbo Nintendo Game Boy Color Carro Rápido P&P;8,18 EUR;+ 18,90 EUR de envío estimado;Vendidos  13 ago 2021Artículo vendido;desde Reino Unido;
Micro Machines V3 (Nintendo Game Boy Color, 2000) Original GBC;7,61 EUR;+ 16,56 EUR de envío estimado;Vendidos  7 ago 2021Artículo vendido;desde Reino Unido;
Nintendo Game Boy juego Micro Machines;12,86 EUR;Envío no especificado;Vendidos  6 ago 2021Artículo vendido;desde Reino Unido;
Micro Machines Game boy caja y juego no manual;17,54 EUR;+ 21,46 EUR de envío estimado;Vendidos  5 ago 2021Artículo vendido;desde Reino Unido;
Micro Machines Para Nintendo Gameboy;8,18 EUR;+ 16,57 EUR de envío estimado;Vendidos  4 ago 2021Artículo vendido;desde Reino Unido;
Micro Machines Nintendo Game Boy Color Advance solo carro de juego probadas Genuino;10,52 EUR;+ 16,61 EUR de envío estimado;Vendidos  1 ago 2021Artículo vendido;desde Reino Unido;
Micro Machines En Caja Original Nintendo Gameboy Juego Completo;35,09 EUR;+ 25,86 EUR de envío estimado;Vendidos  30 jul 2021Artículo vendido;desde Reino Unido;
Nintendo Gameboy Juego-Micro Machines;11,69 EUR;+ 16,64 EUR de envío estimado;Vendidos  6 jul 2021Artículo vendido;desde Reino Unido;
Micro Machines 1 y 2 Twin Turbo-Gameboy Color (sin Caja);5,85 EUR;+ 18,04 EUR de envío estimado;Vendidos  5 jul 2021Artículo vendido;desde Reino Unido;
Micro Machines V3 Nintendo Gameboy Color;10,52 EUR;+ 16,61 EUR de envío estimado;Vendidos  26 jun 2021Artículo vendido;desde Reino Unido;
Nintendo Game Boy Color Colour juego Micro Machines 1 & 2 Twin Turbo. sin probar.;7,02 EUR;+ 18,87 EUR de envío estimado;Vendidos  22 jun 2021Artículo vendido;desde Reino Unido;
Micro Machines Gba Game Boy Advance En Caja Completa PAL;23,39 EUR;+ 16,85 EUR de envío estimado;Vendidos  20 jun 2021Artículo vendido;desde Reino Unido;
Micro Machines 1 & 2 Twin Turbo (Nintendo Gameboy Game Boy Color GBC) solo carro;10,11 EUR;+ 2,96 EUR de envío;Vendidos  13 sep 2021Artículo vendido;desde Estados Unidos;
Micro Machines V3 (Nintendo Game Boy Color, 2000) * ENVÍO GRATUITO *;8,45 EUR;Envío gratis;Vendidos  3 sep 2021Artículo vendido;desde Estados Unidos;
Micro Machines 1 & 2 Twin Turbo (Nintendo Gameboy Game Boy Color GBC) solo carro;9,98 EUR;Envío gratis;Vendidos  23 ago 2021Artículo vendido;desde Estados Unidos;
Micro Machines (Nintendo Game Boy, 1995) carro y caso de fabricante de equipos Originales Envíos Gratis;10,58 EUR;Envío gratis;Vendidos  22 ago 2021Artículo vendido;desde Estados Unidos;
Micro Machines ORIGINAL NINTENDO GAMEBOY probado + trabajo & Auténtico!;5,07 EUR;+ 3,38 EUR de envío;Vendidos  17 ago 2021Artículo vendido;desde Estados Unidos;
Micro Machines Para Nintendo Game Boy Gameboy Cartucho Auténtico! Raro!;16,82 EUR;Envío gratis;Vendidos  13 ago 2021Artículo vendido;desde Estados Unidos;
Nintendo Game Boy Color Micro Machines 1 y 2 Twin Turbo solo carro Probado;8,45 EUR;+ 3,26 EUR de envío;Vendidos  13 ago 2021Artículo vendido;desde Estados Unidos;
NINTENDO GAMEBOY COLOR-Micro Machines V3 Juego Completo Game Boy Color Menta;26,64 EUR;+ 1,68 EUR de envío;Vendidos  9 ago 2021Artículo vendido;desde Estados Unidos;
Micro Machines (Nintendo Game Boy, 1995) solo carro;10,15 EUR;Envío gratis;Vendidos  5 ago 2021Artículo vendido;desde Estados Unidos;
Micro Machines (Nintendo Game Boy, 1995);6,98 EUR;+ 3,77 EUR de envío;Vendidos  5 ago 2021Artículo vendido;desde Estados Unidos;
Micro Machines (Nintendo Game Boy, 1995) caja y todos los complementos sólo;76,06 EUR;Envío gratis;Vendidos  4 ago 2021Artículo vendido;desde Estados Unidos;
Micro Machines (Nintendo Game Boy, 1995) probado y funciona con Estuche;7,61 EUR;Envío gratis;Vendidos  28 jul 2021Artículo vendido;desde Estados Unidos;
Micro Machines V3 (Nintendo Game Boy Color, 2000);5,07 EUR;+ 3,77 EUR de envío;Vendidos  24 jul 2021Artículo vendido;desde Estados Unidos;
Micro Machines – Cart & Manual – Gameboy;12,50 EUR;+ 11,00 EUR de envío;Vendidos  24 jul 2021Artículo vendido;desde Países Bajos;
Micro Machines Nintendo Game Boy Etiqueta de reemplazo (3) para elegir;12,69 EUR;Envío gratis;Vendidos  21 jul 2021Artículo vendido;desde Estados Unidos;
Micro Machines 1 y 2: Twin Turbo (Nintendo Game Boy Color, 1999);10,14 EUR;+ 4,05 EUR de envío;Vendidos  14 jul 2021Artículo vendido;desde Estados Unidos;
Micro Machines Nintendo Gameboy auténtico y probado;10,14 EUR;Envío gratis;Vendidos  12 jul 2021Artículo vendido;desde Estados Unidos;
Mr. Nutz Woody Woodpecker Micro Machines Turbo Game Boy Color;21,15 EUR;+ 4,23 EUR de envío;Vendidos  11 jul 2021Artículo vendido;desde Estados Unidos;
Micro Machines 1 y 2 Twin Turbo (Nintendo Game Boy Color) Auténtico probado!;12,68 EUR;Envío gratis;Vendidos  8 jul 2021Artículo vendido;desde Estados Unidos;
Micro Machines 1 & 2 Twin Turbo (Nintendo Gameboy Game Boy Color GBC) solo carro;9,98 EUR;Envío gratis;Vendidos  25 jun 2021Artículo vendido;desde Estados Unidos;
Micro Machines 96 Turbo Torneo Sega Mega Drive Juego CARTUCHO solo megadrive;8,18 EUR;+ 17,74 EUR de envío estimado;Vendidos  22 ago 2021Artículo vendido;desde Reino Unido;
Micro Machines V3 PS1 Juego Completo;4,62 EUR;+ 7,41 EUR de envío;Vendidos  11 sep 2021Artículo vendido;desde Reino Unido;
Micro Machines Juego-Sega Game Gear;23,38 EUR;+ 16,85 EUR de envío estimado;Vendidos  21 jun 2021Artículo vendido;desde Reino Unido;
Micro Machines 2 Turbo Torneo Sega Game Gear;24,56 EUR;+ 19,01 EUR de envío estimado;Vendidos  20 jun 2021Artículo vendido;desde Reino Unido;
Micro Machines 64 Turbo Nintendo 64 N64 Juego Con Manual PAL Reino Unido limpiado & Probado;21,05 EUR;+ 18,94 EUR de envío estimado;Vendidos  17 ago 2021Artículo vendido;desde Reino Unido;
Micro Machines World Series PS4 Juego en Caja con Manual 💥;11,64 EUR;+ 16,64 EUR de envío estimado;Vendidos  25 ago 2021Artículo vendido;desde Reino Unido;
Sega Mega Drive juego Micro Machines Turbo Torneo CARTUCHO PAL;9,35 EUR;+ 16,59 EUR de envío estimado;Vendidos  8 sep 2021Artículo vendido;desde Reino Unido;
Micro Machines 64 Turbo-Nintendo 64 N64 Juego en Caja con Manual-Libre P&P;40,89 EUR;+ 17,16 EUR de envío estimado;Vendidos  24 ago 2021Artículo vendido;desde Reino Unido;
Micro Machines World Series PS4 Playstation 4 juego probado + Garantía Como Nuevo Barato;11,69 EUR;+ 16,64 EUR de envío estimado;Vendidos  21 jul 2021Artículo vendido;desde Reino Unido;
Juego Sega Megadrive Micro Machines;12,86 EUR;+ 16,66 EUR de envío estimado;Vendidos  25 ago 2021Artículo vendido;desde Reino Unido;
Sega Mega Drive Juego PAL Micro Machines-Completo con Manual libre de Reino Unido P&p;15,20 EUR;+ 16,70 EUR de envío estimado;Vendidos  13 jul 2021Artículo vendido;desde Reino Unido;
Micro Machines Sega Mega Drive juego GENESIS en Caja Con Manual Pal oficiales del Reino Unido;26,90 EUR;+ 16,91 EUR de envío estimado;Vendidos  28 ago 2021Artículo vendido;desde Reino Unido;
Micro Machines 64 Turbo Nintendo 64 N64 PAL UK Juego en caja con instrucciones. CIB;46,79 EUR;+ 9,36 EUR de envío;Vendidos  27 jul 2021Artículo vendido;desde Reino Unido;
Micro Machines V3 PS1 Juego UK PAL USADO;4,50 EUR;+ 16,51 EUR de envío estimado;Vendidos  22 jun 2021Artículo vendido;desde Reino Unido;
Sega Megadrive Consola Juego-Micro Machines 96;15,20 EUR;+ 16,70 EUR de envío estimado;Vendidos  13 sep 2021Artículo vendido;desde Reino Unido;
Micro Machines MEGADRIVE cartucho de juego solamente! Sega 💥;10,52 EUR;+ 16,61 EUR de envío estimado;Vendidos  24 jul 2021Artículo vendido;desde Reino Unido;
Micro Machines 2 Turbo Torneo Sega Mega Drive Juego en Caja Probado Funcionando PAL;13,98 EUR;+ 25,74 EUR de envío;Vendidos  30 ago 2021Artículo vendido;desde Reino Unido;
Micro Machines Sega Mega Drive Genesis Juego en Caja Con Manual Pal oficiales del Reino Unido;26,90 EUR;+ 16,91 EUR de envío estimado;Vendidos  22 jul 2021Artículo vendido;desde Reino Unido;
Paquete De Juegos Xbox One. Perfecto para niños. Snoopy's. Micro Machines. yooka-laylee;35,10 EUR;+ 17,06 EUR de envío estimado;Vendidos  21 jun 2021Artículo vendido;desde Reino Unido;
Micro Machines 2 Turbo Torneo Sega Megadrive Juego Con Manual;19,83 EUR;+ 16,78 EUR de envío estimado;Vendidos  7 sep 2021Artículo vendido;desde Reino Unido;
SEGA Megadrive Micro Machines Juego (PAL) * * Completo y Probado;14,04 EUR;+ 20,42 EUR de envío estimado;Vendidos  16 jul 2021Artículo vendido;desde Reino Unido;
Micro Machines 2 Turbo Torneo Sega Game Gear;23,34 EUR;+ 16,85 EUR de envío estimado;Vendidos  22 ago 2021Artículo vendido;desde Reino Unido;
Micro Machines World Series (PlayStation 4 juego) PS4;11,64 EUR;+ 16,64 EUR de envío estimado;Vendidos  3 ago 2021Artículo vendido;desde Reino Unido;
