Gameboy Classic juego Earthworm Jim EUR nuevo sin abrir sin usar;259,90 EUR;+ 36,99 EUR de envío;desde Alemania;
Earthworm Jim Menace 2 The Galaxy (Nintendo Game Boy Color 1999) Cartucho/Manual;11,47 EUR;+ 16,65 EUR de envío estimado;desde Reino Unido;
Nintendo Game Boy Classic juego Earthworm Jim Menace 2 the Galaxy módulo EUR;14,90 EUR;+ 8,99 EUR de envío;desde Alemania;
Nintendo Gameboy-Earthworm Jim-Wata 9.4/embalaje original-no VGA no AFA-nuevo;2.500,00 EUR;Envío no especificado;desde Alemania;
Earthworm Jim-Nintendo Gameboy Advance-Cartucho únicamente;11,71 EUR;+ 16,66 EUR de envío estimado;desde Reino Unido;
Nintendo Gameboy (gb) // Earthworm Jim + embalaje original + instrucciones // dt. PAL cib;89,99 EUR;+ 5,99 EUR de envío;desde Alemania;
Earthworm Jim Gameboy Advance GBA SP Nintendo Original! GB;11,71 EUR;+ 16,66 EUR de envío estimado;desde Reino Unido;
Earthworm Jim 2 (Nintendo Game Boy Color, 1995);17,56 EUR;+ 11,71 EUR de envío;desde Reino Unido;
Nintendo Gameboy Juego-Earthworm Jim;25,72 EUR;+ 16,91 EUR de envío estimado;desde Reino Unido;
Earthworm Jim 2 Nintendo Gameboy Advance Juego;16,98 EUR;+ 21,09 EUR de envío;desde Reino Unido;
Original Genuino NINTENDO GAMEBOY COLOR Juego Earthworm Jim 2 Menace 2 The Galaxy;11,66 EUR;+ 16,66 EUR de envío estimado;desde Reino Unido;
Raro GBA NINTENDO GAMEBOY Earthworm Jim Video Juego Original 13a;18,77 EUR;+ 16,79 EUR de envío estimado;desde Reino Unido;
Earthworm Jim Menace 2 The Galaxy (Nintendo Game Boy Color, 1999) - europea..;11,66 EUR;+ 16,66 EUR de envío estimado;desde Reino Unido;
Nintendo Gameboy-Earthworm Jim;23,38 EUR;+ 16,87 EUR de envío estimado;desde Reino Unido;
Earthworm Jim 2 gameboy cartucho sólo;14,06 EUR;+ 18,84 EUR de envío estimado;desde Reino Unido;
Earthworm Jim Menace 2 The Galaxy (Nintendo Game Boy Color, 1999) - europea..;11,71 EUR;+ 18,46 EUR de envío estimado;desde Reino Unido;
Nintendo Gameboy Advance GBA Juego-Earthworm Jim;14,00 EUR;+ 16,70 EUR de envío estimado;desde Reino Unido;
Earthworm Jim Gameboy Advance Nintendo 100% Genuino;11,71 EUR;+ 32,02 EUR de envío estimado;desde Reino Unido;
Earthworm Jim-Nintendo Gameboy Advance-Cartucho únicamente;11,72 EUR;+ 18,17 EUR de envío estimado;desde Reino Unido;
Nintendo Gameboy Juego-Earthworm Jim;23,42 EUR;+ 16,87 EUR de envío estimado;desde Reino Unido;
Earthworm Jim VF [Complet]  Game Boy / GBA / GBA SP;110,00 EUR;+ 17,50 EUR de envío;desde Francia;
Earthworm Jim amenaza Nintendo Gameboy 2 Cartucho de la galaxia;7,32 EUR;+ 17,58 EUR de envío estimado;desde Reino Unido;
Earthworm Jim Gameboy Advance Gba EUR;12,88 EUR;+ 18,48 EUR de envío estimado;desde Reino Unido;
Earthworm Jim Menace 2 The Galaxy Game Boy Color ENG USA NINTENDO GBC No Zelda;18,90 EUR;+ 5,50 EUR de envío;desde Italia;
Nintendo Game Boy Advance Bundle-Mario Kart Super Circuit & Earthworm Jim 2;23,42 EUR;+ 16,87 EUR de envío estimado;desde Reino Unido;
Earthworm Jim-Menace 2 the Galaxy-Nintendo Gameboy Colour juego cartridgeonly;15,22 EUR;+ 16,72 EUR de envío estimado;desde Reino Unido;
Nintendo Game Boy Color Earthworm Jim 2 Menace The Galaxy Notice / Instruction ;4,99 EUR;+ 2,75 EUR de envío;desde Francia;
Earthworm Jim GBA Gameboy Advance;14,05 EUR;+ 18,84 EUR de envío estimado;desde Reino Unido;
Earthworm Jim Instrucciones Manual GBA Gameboy Advance;7,03 EUR;+ 18,49 EUR de envío estimado;desde Reino Unido;
Nintendo Game Boy Advance Solo Manual-Earthworm Jim 2;4,69 EUR;+ 17,71 EUR de envío estimado;desde Reino Unido;
Earthworm Jim (Nintendo Game Boy Advance, 2001) Boxed;60,00 EUR;Envío no especificado;desde Alemania;
