Astérix Nintendo Game Boy PAL ESPAÑA;269,99 EUR;+ 5,99 EUR de envío;
Juego Astérix y Obelix.Nintendo Game boy.;14,00 EUR;+ 2,00 EUR de envío;
Juego Astérix y Obelix.Consola Nintendo Game boy advance.;9,00 EUR;+ 2,00 EUR de envío;
Astérix & Obélix (Nintendo Game Boy Color, 1995) - Cartucho únicamente;17,56 EUR;+ 11,71 EUR de envío estimado;desde Reino Unido;
Nintendo Game Boy Color Astérix en la búsqueda de Ideafix, embalaje original;19,90 EUR;+ 14,00 EUR de envío;desde Alemania;
Nintendo Game Boy Color Astérix en la búsqueda de Ideafix en OVP con instrucciones;24,95 EUR;+ 7,49 EUR de envío;desde Alemania;
