Nintendo Gameboy Konami Golf En Caja Completa probada;15,68 EUR;+ 18,58 EUR de envío estimado;desde Reino Unido;
Konamic golf Nintendo Game Boy juego bien Gameboy Konami Golf;15,90 EUR;Envío no especificado;desde Alemania;
Gameboy Konami Golf Funcionando Perfectamente Reino Unido versión komamic;5,84 EUR;Envío no especificado;desde Reino Unido;
Konami Golf Gig Nintendo Game Boy PAL;43,67 EUR;+ 8,14 EUR de envío;desde Italia;
Konamic Konami Golf Gameboy Japanese Import Version Cartridge Only DMG-KGA Japan;7,82 EUR;Envío internacional gratis;desde Canadá;
Konami Golf Gig Nintendo Juego Boy Pal;35,59 EUR;+ 16,00 EUR de envío;desde Italia;
