Battletoads Nintendo game boy game complete;82,01 EUR;+41,86 EUR shipping estimate;from United Kingdom;
Battletoads Ragnarok's World-Game Boy-Module-GAMEBOY-VGC;11,99 EUR;Shipping not specified;from Germany;
Game Boy-Battletoads-DMG-BV - FRG-Original Box & Manual CIB Nintendo Gameboy Top;199,95 EUR;Shipping not specified;from Germany;
Battletoads game boy Gameboy Originale Nintendo ITA (no zelda pokemon metroid);22,35 EUR;+12,99 EUR shipping;from Italy;
Battletoads in Ragnaroks World Nintendo Game Boy Cart Only Region Free Gameboy ;17,52 EUR;+16,77 EUR shipping estimate;from United Kingdom;
Nintendo Game Boy Battletoads in Ragnarok's World DMG-R7-ITA MADE in JAPAN;15,00 EUR;+28,00 EUR shipping;from Italy;
Giochi game boy tetris Tennis Terminator Battletoads Ecc;40,00 EUR;Shipping not specified;from Italy;
Genuine Nintendo Gameboy Game - Battletoads in Ragnaroks World - Tested/Working;25,78 EUR;+16,92 EUR shipping estimate;from United Kingdom;
Gameboy Battletoads in Ragnarok's World PAL ESP Original;34,95 EUR;+9,00 EUR shipping;from Spain;
Battletoads Gameboy Game;17,58 EUR;+18,69 EUR shipping estimate;from United Kingdom;
Battletoads In Ragnarok's World GameBoy Original Nintendo Cartridge PAL;17,56 EUR;+16,77 EUR shipping estimate;from United Kingdom;
GB-Battletoads in Ragnarok's World for Nintendo Gameboy;12,95 EUR;+9,95 EUR shipping;from Germany;
Jeu Gameboy Gb Battletoads;25,91 EUR;+39,00 EUR shipping;from France;
GB-Battletoads in Ragnarok's World for Nintendo Gameboy Classic * TESTED;10,95 EUR;Shipping not specified;from Germany;
Battletoads in Ragnarok's World (DMG-R7-NOE) Nintendo Game Boy;40,00 EUR;Shipping not specified;from Germany;
