Vintage Video Juego Nintendo GameBoy Blodia * Importado Japonés *;9,37 EUR;+ 11,13 EUR de envío;desde Reino Unido;
Nintendo Gameboy Juego Original GB Blodia;17,58 EUR;+ 19,64 EUR de envío estimado;desde Reino Unido;
Blodia Nintendo Gameboy Japonés Original Cartucho De Juego DMG-BLA;10,53 EUR;+ 16,64 EUR de envío estimado;desde Reino Unido;
Blodia Nintendo Game Boy Japón ・ Puzzle juega en Reino Unido/UE/NOSOTROS Juego Boy timeball;5,85 EUR;Envío no especificado;desde Reino Unido;
Blodia Game Boy GB Japón importación cartucho sólo;5,92 EUR;Envío gratis;desde Estados Unidos;
Nintendo Game Boy GB Blodia Cartucho sólo Japón Edición Vendedor de Estados Unidos;10,06 EUR;+ 2,11 EUR de envío;desde Estados Unidos;
Lote de juego japonés 4x Gameboy * Bomber Boy-Nemesis-Serpiente-Blodia * Probado;38,06 EUR;Envío gratis;desde Estados Unidos;
Qix + Blodia Japón Ver Nintendo GameBoy;6,77 EUR;+ 3,51 EUR de envío;desde Estados Unidos;
Blodia / Timeball USED GB GAME ONLY GameBoy;2,50 EUR;+ 5,58 EUR de envío;desde Canadá;
Game Boy Blodia sin probar compatible con japonés Juego Usado consolas (00S44);12,27 EUR;+ 10,15 EUR de envío;desde Japón;
Blodia / Timeball (Nintendo Game Boy GB, 1990) Japan Import;6,00 EUR;+ 3,84 EUR de envío;desde Canadá;
Nintendo Blodia versión japonesa juego para Nintendo Game Boy Japón Envío gratuito;25,61 EUR;Envío internacional gratis;desde Japón;
Blodia--Nintendo Game Boy--NTSC JAP--C-Ware;4,20 EUR;+ 1,09 EUR de envío;desde Austria;
Blodia Nintendo Gameboy GB Japón importación Probado Usado;8,45 EUR;Envío internacional gratis;desde Japón;
Casa de Tonkin 1990 Blodia Nintendo Gameboy GB Rompecabezas Japonés Retro Juego Japón Usado;30,57 EUR;Envío internacional gratis;desde Japón;
Blodia Nintendo Gameboy Japanese Cartridge Only DMG-BLA Made in Japan Manuel;11,40 EUR;Envío internacional gratis;desde Canadá;
Blodia Completo Conjunto! Japón Nintendo Gameboy GB Excelente!;19,29 EUR;+ 7,44 EUR de envío;desde Japón;
Blodia Japón Nintendo Gameboy GB Muy Buen Estado!;4,91 EUR;+ 7,44 EUR de envío;desde Japón;
Gameboy Gb/Blodia/burodia/Cassette sólo/Probado/G Sin Caja Solo Cartucho;23,46 EUR;+ 16,92 EUR de envío;desde Japón;
Blodia Nintendo Game Boy GB 192;6,76 EUR;+ 8,46 EUR de envío;desde Japón;
Bp1048 timeball Blodia Gameboy Game Boy Japan;1,45 EUR;+ 14,37 EUR de envío;desde Japón;
Game Boy Boxeo Mar Volley Blodia GB japonés juego recorte de Revista Promo;7,51 EUR;+ 21,15 EUR de envío;desde Japón;
Bo9571 timeball Blodia Gameboy Game Boy Japan;1,02 EUR;+ 14,37 EUR de envío;desde Japón;
Blodia Gameboy Nintendo BCC GB;10,15 EUR;+ 14,38 EUR de envío;desde Japón;
Blodia Menta Gameboy Nintendo 392 GB;25,38 EUR;+ 14,38 EUR de envío;desde Japón;
Gameboy Blodia GB Nintendo Cartucho sólo GBC;5,92 EUR;+ 14,38 EUR de envío;desde Japón;
GB -- Blodia -- Caja. juego Boy, Japón Juego Nintendo. Clean & trabajar completamente!!! 11705;6,77 EUR;+ 4,23 EUR de envío;desde Japón;
GB -- Blodia -- Caja. juego Boy, Japón Juego Nintendo. Clean & trabajar completamente!!! 11705;11,42 EUR;+ 4,23 EUR de envío;desde Japón;
