Nintendo Gameboy GB GBC GBA SP - Disney's Aladdin + Manual;11,25 EUR;+ 4,50 EUR de envío;Vendidos  12 sep 2021Artículo vendido;desde Países Bajos;
Disney's Aladdin-Nintendo Game Boy Color-limpiado & probado-GBC y GBA;12,68 EUR;Envío internacional gratis;Vendidos  19 ago 2021Artículo vendido;desde Ucrania;
Disney's Aladdin Nintendo Gameboy Juego;11,66 EUR;+ 16,66 EUR de envío estimado;Vendidos  21 jun 2021Artículo vendido;desde Reino Unido;
Disney's Aladdin Con Manual (Nintendo Game Boy, 1995) Completo En Caja;50,75 EUR;+ 5,07 EUR de envío;Vendidos  9 sep 2021Artículo vendido;desde Canadá;
Disney's Aladdin for the Nintendo Gameboy Advance ;40,04 EUR;+ 13,35 EUR de envío;Vendidos  5 sep 2021Artículo vendido;desde Canadá;
Disney's Aladdin (Nintendo Game Boy Color, 2000) Game Only Canadian Seller;16,65 EUR;+ 3,30 EUR de envío;Vendidos  2 sep 2021Artículo vendido;desde Canadá;
Disney's Aladdin-Nintendo Game Boy Color-Envío Gratuito;12,69 EUR;Envío gratis;Vendidos  25 ago 2021Artículo vendido;desde Estados Unidos;
Nintendo Game Boy Disney's Aladdin Nintendo Game Boy cartucho sólo;4,22 EUR;+ 3,38 EUR de envío;Vendidos  20 ago 2021Artículo vendido;desde Estados Unidos;
Disney's Aladdin (Nintendo Game Boy Color, 2000) Auténtico cartucho sólo;8,45 EUR;+ 3,64 EUR de envío;Vendidos  19 ago 2021Artículo vendido;desde Estados Unidos;
Disney's Aladdin Con Manual (Nintendo Game Boy, 1995);16,81 EUR;Envío gratis;Vendidos  17 ago 2021Artículo vendido;desde Estados Unidos;
Disney's Aladdin-Nintendo Game Boy Color-Envío Gratuito;12,59 EUR;Envío gratis;Vendidos  14 ago 2021Artículo vendido;desde Estados Unidos;
Disney's Aladdin Game Boy Game - Authentic Cartridge - GAME ONLY -;12,00 EUR;+ 9,33 EUR de envío;Vendidos  2 ago 2021Artículo vendido;desde Canadá;
Disney's Aladdin (Nintendo Game Boy, 1993) solo carro;16,07 EUR;+ 3,76 EUR de envío;Vendidos  17 jul 2021Artículo vendido;desde Estados Unidos;
Disney's Aladdin Nintendo Gameboy Auténtico Original;7,60 EUR;Envío gratis;Vendidos  16 jul 2021Artículo vendido;desde Estados Unidos;
Nintendo Game Boy Disney's Aladdin Juego;10,11 EUR;Envío gratis;Vendidos  6 jul 2021Artículo vendido;desde Estados Unidos;
Disney's Aladdin Genuino Sega Genesis Juego Cartucho Solo;11,54 EUR;+ 14,06 EUR de envío;Vendidos  12 ago 2021Artículo vendido;desde Reino Unido;
SEGA Megadrive Disney's Aladdin Juego (PAL) * Probado *;9,96 EUR;+ 20,38 EUR de envío estimado;Vendidos  20 jul 2021Artículo vendido;desde Reino Unido;
Disney's Aladdin Sega Game Gear en caja completa probada limpiado.;17,40 EUR;+ 14,06 EUR de envío;Vendidos  15 sep 2021Artículo vendido;desde Reino Unido;
Disney's Aladdin Super Nintendo Juego Snes PAL Reino Unido solo carro GRATIS UK FRANQUEO;15,22 EUR;+ 16,72 EUR de envío estimado;Vendidos  4 ago 2021Artículo vendido;desde Reino Unido;
Super Nintendo SNES Disney's Aladdin noe sealed nuevo;159,90 EUR;+ 36,99 EUR de envío;Vendidos  26 jul 2021Artículo vendido;desde Alemania;
Disney's Aladdin Super Nintendo SNES solo carro PAL;15,17 EUR;+ 16,72 EUR de envío estimado;Vendidos  12 sep 2021Artículo vendido;desde Reino Unido;
Disney's Aladdin - Sega Megadrive;14,90 EUR;+ 15,00 EUR de envío;Vendidos  8 sep 2021Artículo vendido;desde Francia;
Disney's Aladdin (Sega Mega Drive) PAL OVP/módulo/instrucciones #bg5;24,88 EUR;+ 9,50 EUR de envío;Vendidos  12 ago 2021Artículo vendido;desde Alemania;
Disney's Aladdin en Nasira's Revenge PS1 PS2 PS3 PLAYSTATION juego-completo;10,49 EUR;+ 11,72 EUR de envío;Vendidos  24 jul 2021Artículo vendido;desde Reino Unido;
Snes super nintendo Disney's Aladdin NTSC con embalaje original sin instrucciones EE. UU.;29,90 EUR;+ 8,99 EUR de envío;Vendidos  23 ago 2021Artículo vendido;desde Alemania;
Disney's Aladdin Sega Mega Drive Juego Con Manual * ENVÍO GRATIS * UK;17,58 EUR;+ 12,89 EUR de envío;Vendidos  9 ago 2021Artículo vendido;desde Reino Unido;
Disney's Aladdin Sega Mega Drive juego PAL;12,88 EUR;+ 18,48 EUR de envío estimado;Vendidos  29 ago 2021Artículo vendido;desde Reino Unido;
