Shadow Warriors + Double Dragon 2 ITALIAN Version Mattel Scatole  GAME BOY Lotto;19,90 EUR;Envío no especificado;desde Italia;
Shadow Warriors Gioco per Nintendo Game Boy Classic funzionante Pal videogioco ;38,90 EUR;+ 9,50 EUR de envío;desde Italia;
Nintendo Game Boy Classic juego Shadow Warriors módulo frg;34,90 EUR;+ 8,99 EUR de envío;desde Alemania;
Shadow Warriors - Version ITA -  GAMEBOY GB game boy ;175,00 EUR;Envío no especificado;desde Francia;
Gb-Shadow Warriors para Nintendo GameBoy;39,95 EUR;+ 9,95 EUR de envío;desde Alemania;
Juego Game Boy Advance 108 En 1 - Shadow Warrior+Monster Truck Wars+Topgun+The A;6,00 EUR;Envío no especificado;desde España;
Juegos 11 en 1 Gameboy/GB Color/GBA Contra, Double Dragon,Shadow Warriors...;24,95 EUR;Envío no especificado;desde España;
Shadow Warriors Double Dragon 2 ITALIAN Mattel artbox bundle compatible game boy;19,90 EUR;Envío no especificado;desde Italia;
Ninja Gaiden /Shadow Warriors - repro box with insert - Gameboy /GB. HQ!;11,39 EUR;+ 5,26 EUR de envío;desde Polonia;
Game Boy GB Game CASE ONLY - Shadow Warriors Ninja Gaiden;8,65 EUR;+ 17,05 EUR de envío;desde Australia;
Sólo instrucciones gameboy Shadow Warriors;126,87 EUR;Envío gratis;desde Estados Unidos;
Commodore 64/128 💎 1990 Shadow Warriors 💎 Océano 💎 Juego Con Caja;9,90 EUR;+ 23,34 EUR de envío;desde Reino Unido;
Shadow Warrior PS4 juego libre UK FRANQUEO;16,25 EUR;+ 5,85 EUR de envío;desde Reino Unido;
Shadow Warrior | Océano | Commodore 64 C64 video juego Cassette | Completo;17,55 EUR;+ 20,84 EUR de envío estimado;desde Reino Unido;
Shadow Warrior PS4 Nuevo Sellado PAL Reino Unido versión juego Sony PlayStation 4 Warrier;81,79 EUR;+ 22,63 EUR de envío estimado;desde Reino Unido;
Shadow Warrior PC juego Game mercancía nueva en funda y guía;44,95 EUR;+ 10,90 EUR de envío;desde Alemania;
