Nemesis CIB game boy gb gameboy;65,00 EUR;+ 15,99 EUR de envío;desde España;
Nemesis 2: return of the Hero 1992-Nintendo Game Boy Classic OVP rar | cib;99,99 EUR;Envío no especificado;desde Alemania;
Vintage Video Juego Nintendo GameBoy Nemesis * Importado Japonés *;14,04 EUR;+ 11,12 EUR de envío;desde Reino Unido;
Nintendo Game Boy Japón JOBLOT off 25 Juegos Pokemon Rockman Mario Nemesis;67,65 EUR;+ 10,58 EUR de envío;desde Países Bajos;
Nemesis Gradius Nintendo Game Boy Japan Ver. Shmup Shooting Konami 1990 DMG-NMA ;51,29 EUR;+ 7,00 EUR de envío;desde Francia;
Nemesis | GameBoy🕹 | Good Condition 🌍;10,00 EUR;+ 3,50 EUR de envío;desde Países Bajos;
Nintendo Gameboy Juego-Nemesis el regreso del héroe;27,33 EUR;+ 16,92 EUR de envío estimado;desde Reino Unido;
Nintendo Game Boy Nemesis buena condición;70,19 EUR;+ 22,42 EUR de envío estimado;desde Reino Unido;
NINTENDO GAME BOY - Konami Nemesis - Instruction Booklet Manual Italian;12,70 EUR;+ 4,45 EUR de envío;desde Italia;
Nemesis -  Instruction Booklet | GameBoy🕹 | Manuale Di Instruzioni | ITA;8,00 EUR;+ 2,00 EUR de envío;desde Países Bajos;
Nemesis-Nintendo Gameboy Juego [EE. UU. en Caja con Manual CIB] [RESERVADO];467,97 EUR;+ 17,49 EUR de envío;desde Reino Unido;
Nintendo Gameboy Nemesis;13,95 EUR;+ 2,95 EUR de envío;desde Países Bajos;
Nemesis Nintendo Game Boy Cartucho y Manual Solamente!;23,39 EUR;+ 16,85 EUR de envío estimado;desde Reino Unido;
Nemesis Game Boy Spiel #1611;27,52 EUR;+ 15,37 EUR de envío;desde Suiza;
Nemesis * Nintendo GameBoy * FAH ;129,95 EUR;+ 21,00 EUR de envío;desde Países Bajos;
Konami Nemesis Gradius Nintendo Gameboy Cart Only European UKV 1990;9,99 EUR;+ 5,00 EUR de envío;desde Países Bajos;
Nemesis Nintendo Gameboy Japonés Original Cartucho De Juego DMG-Pastoral;15,20 EUR;+ 16,70 EUR de envío estimado;desde Reino Unido;
Game Boy GB:Nemesis II 2 - Gradius [TOP KONAMI & EDITION RARE] Jap;99,90 EUR;+ 30,30 EUR de envío;desde Francia;
Japonés Nintendo Gameboy Juego-DMG-Pastoral-Nemesis;15,75 EUR;+ 16,71 EUR de envío estimado;desde Reino Unido;
Nemesis Gameboy usa carro + Manual #0012;23,34 EUR;+ 20,01 EUR de envío estimado;desde Reino Unido;
Nemesis game boy;25,00 EUR;+ 6,00 EUR de envío;desde Francia;
Nemesis (Game Boy GB 1990) solo cartucho;19,90 EUR;+ 12,90 EUR de envío;desde España;
Nemesis - repro box with insert - Gameboy /GB. HQ!;11,39 EUR;+ 5,26 EUR de envío;desde Polonia;
Nemesis Nintendo Game Boy GB NTSC-J Región FREE Rare;19,99 EUR;+ 19,99 EUR de envío;desde España;
Nuevo anuncioNintendo GameBoy jeu - Nemesis 1 cartouche utilisé;22,99 EUR;Envío internacional gratis;desde Alemania;
Nemesis Para El Juego Original Nintendo Gameboy Cartucho y sólo PAL UK;12,86 EUR;+ 18,12 EUR de envío estimado;desde Reino Unido;
Nuevo anuncioNintendo GameBoy gioco - Nemesis 1 cartuccia usato;24,99 EUR;Envío internacional gratis;desde Alemania;
Nuevo anuncioNintendo GameBoy juego - Nemesis 1 cartucho usado;24,99 EUR;Envío internacional gratis;desde Alemania;
Nemesis Gameboy Cartucho probado y trabajo EE. UU. ** Free P & P **;11,64 EUR;+ 17,49 EUR de envío;desde Reino Unido;
