Dragon Slayer Gaiden: Nemuri no Oukan RPG Japan Gameboy GB game;30,45 EUR;+10,15 EUR shipping;from Russian Federation;
Dragon Slayer Gaiden Nemuri no Oukan--Nintendo Game Boy--NTSC JAP--B-Ware;15,87 EUR;+0,59 EUR shipping;from Austria;
Nintendo GameBoy game - Dragon Slayer Gaiden: Nemuri no Oukan JAPAN cartridge;20,29 EUR;Free International Shipping;from Germany;
Nintendo GameBoy game Dragon Slayer Gaiden: Nemuri no Oukan JAPAN cartridge;23,42 EUR;Free International Shipping;from Germany;
Nintendo GameBoy game - Dragon Slayer Gaiden: Nemuri no Oukan JAPAN cartridge;22,68 EUR;Free International Shipping;from Germany;
Nintendo GameBoy - Dragon Slayer Gaiden: Nemuri no Oukan JAPAN cartouche utilisé;26,99 EUR;Free International Shipping;from Germany;
Nintendo GameBoy - Dragon Slayer Gaiden: Nemuri no Oukan JAPAN cartuccia usato;28,99 EUR;Free International Shipping;from Germany;
Nintendo GameBoy - Dragon Slayer Gaiden: Nemuri no Oukan JAPAN cartucho usado;28,99 EUR;Free International Shipping;from Germany;
Gameboy Dragon Slayer Gaiden No Instruction bcn Nintendo gb;42,30 EUR;+14,38 EUR shipping;from Japan;
Dragon Slayer Gaiden GAME BOY Japan Version;81,91 EUR;+16,92 EUR shipping;from Japan;
GB Dragon Slayer Gaiden Sleeping Crown Game Boy used JPN;66,83 EUR;Free International Shipping;from Japan;
Dragon Slayer Gaiden Nemuri no Oukan Japan Nintendo Gameboy GB VG!;16,92 EUR;+9,14 EUR shipping;from Japan;
Dragon Slayer Gaiden Nemuri no Oukan Japan Nintendo Gameboy GB VG!;15,06 EUR;+6,34 EUR shipping;from Japan;
Dragon Slayer Gaiden Nemuri no Oukan Japan Nintendo Gameboy *USA SELLER*;59,21 EUR;+3,64 EUR shipping;from United States;
bo7285 Dragon Slayer Gaiden GameBoy Game Boy Japan;2,41 EUR;+14,37 EUR shipping;from Japan;
bo9287 Dragon Slayer Gaiden GameBoy Game Boy Japan;2,79 EUR;+14,37 EUR shipping;from Japan;
Dragon Slayer Gaiden Nemuri no Oukan Japan Nintendo Gameboy GB;31,21 EUR;+21,15 EUR shipping;from Japan;
bo5546 Dragon Slayer Gaiden GameBoy Game Boy Japan;3,27 EUR;+14,37 EUR shipping;from Japan;
GB Software Dragon Slayer Gaiden Box Retro data save Video Game Boy JAPAN 11952;61,93 EUR;+19,46 EUR shipping;from Japan;
Game boy GB Dragon Slayer Gaiden Sleeping Crown (Soft Only) Boy Acceptable #182;38,90 EUR;Free International Shipping;from Japan;
Nintendo Game Boy Epoch Dragon Slayer Gaiden Sleeping Crown Layer Good #1C0F;65,97 EUR;+16,88 EUR shipping;from Japan;
