Nintendo Gameboy-Prince of Persia-Embalaje original-Top-Pal;79,90 EUR;Envío no especificado;Vendidos  8 sep 2021Artículo vendido;desde Alemania;
Prince of Persia Nintendo Game Boy Advance GBA OVP cib;27,90 EUR;Envío no especificado;Vendidos  4 sep 2021Artículo vendido;desde Alemania;
Prince of Persia Las Arenas De Tiempo-GAMEBOY ADVANCE GBA Carro De Juego Y Manual;8,16 EUR;+ 11,69 EUR de envío;Vendidos  3 sep 2021Artículo vendido;desde Reino Unido;
Nintendo Gameboy Juego-Prince of Persia;16,32 EUR;+ 16,72 EUR de envío estimado;Vendidos  27 ago 2021Artículo vendido;desde Reino Unido;
GAMEBOY avanzada Prince of Persia Arenas De Tiempo De Juego En Caja;9,35 EUR;+ 18,73 EUR de envío estimado;Vendidos  21 jul 2021Artículo vendido;desde Reino Unido;
Prince of Persia Las Arenas De Tiempo-NINTENDO GAMEBOY ADVANCE;5,72 EUR;+ 5,84 EUR de envío;Vendidos  16 jul 2021Artículo vendido;desde Reino Unido;
Prince of Persia y Tomb Raider Gameboy Advance Sin Caja;8,18 EUR;+ 16,57 EUR de envío estimado;Vendidos  12 jul 2021Artículo vendido;desde Reino Unido;
Nintendo Gameboy Color juego-Prince of Persia (módulo);24,99 EUR;+ 67,99 EUR de envío;Vendidos  1 jul 2021Artículo vendido;desde Alemania;
Prince of Persia – DMG-NP-noe-Nintendo Game Boy-raras;13,00 EUR;Envío no especificado;Vendidos  27 jun 2021Artículo vendido;desde Alemania;
Nintendo Gameboy-Prince of Persia Envío Gratuito Reino Unido;23,13 EUR;+ 16,84 EUR de envío estimado;Vendidos  27 jun 2021Artículo vendido;desde Reino Unido;
Prince of Persia Game Boy FRG TBE;65,00 EUR;Envío internacional gratis;Vendidos  26 jun 2021Artículo vendido;desde Francia;
Prince of Persia (Nintendo Game Boy Color, 1999) ***Tested;12,03 EUR;+ 5,34 EUR de envío;Vendidos  9 sep 2021Artículo vendido;desde Canadá;
Prince of Persia Nintendo Game Boy limpiado & probado Auténtico;12,68 EUR;Envío gratis;Vendidos  7 sep 2021Artículo vendido;desde Estados Unidos;
Prince of Persia (Nintendo Game Boy avanzada) Arena de tiempo;4,22 EUR;+ 3,55 EUR de envío;Vendidos  6 sep 2021Artículo vendido;desde Estados Unidos;
Prince of Persia: las Arenas de tiempo de juego Boy Advance * AUTÉNTICO *;8,46 EUR;+ 3,29 EUR de envío;Vendidos  3 sep 2021Artículo vendido;desde Estados Unidos;
Prince of Persia Con Manual Nintendo Game Boy Color * forma agradable *;25,36 EUR;Envío gratis;Vendidos  3 sep 2021Artículo vendido;desde Estados Unidos;
Prince of Persia (Nintendo Game Boy, 1992);12,69 EUR;Envío gratis;Vendidos  1 sep 2021Artículo vendido;desde Estados Unidos;
Prince of Persia: las Arenas De Tiempo GBA Nintendo Game Boy Advance no para la reventa;24,49 EUR;Envío gratis;Vendidos  24 ago 2021Artículo vendido;desde Estados Unidos;
Game Boy Prince of Persia Japón GameBoy GB Juego Vendedor de Estados Unidos;16,07 EUR;Envío gratis;Vendidos  20 ago 2021Artículo vendido;desde Estados Unidos;
Prince of Persia Sands of Time GameBoy advance with Manual Tested Working;16,74 EUR;+ 14,26 EUR de envío;Vendidos  15 ago 2021Artículo vendido;desde Australia;
Prince of Persia Nintendo Gameboy Game Boy Color 1999 Suelto Probado Funcionando ESRB;16,91 EUR;Envío gratis;Vendidos  14 ago 2021Artículo vendido;desde Estados Unidos;
Prince of Persia (Nintendo Game Boy, 1992) Completo En Caja;59,22 EUR;+ 3,47 EUR de envío;Vendidos  13 ago 2021Artículo vendido;desde Estados Unidos;
Prince of Persia: las Arenas De Tiempo Gameboy Advance GBA, solo carro Probado;8,46 EUR;+ 3,55 EUR de envío;Vendidos  8 ago 2021Artículo vendido;desde Estados Unidos;
Prince of Persia ~ GameBoy ~ Funda ~ ~ Manual Auténtico;16,84 EUR;Envío gratis;Vendidos  2 ago 2021Artículo vendido;desde Estados Unidos;
Prince of Persia con estuche (Nintendo Game Boy, 1992) probado y de trabajo.;14,38 EUR;Envío gratis;Vendidos  31 jul 2021Artículo vendido;desde Estados Unidos;
Prince of Persia Las Arenas De Tiempo Gameboy Advance GBA "no para la reventa" juego;14,38 EUR;Envío gratis;Vendidos  30 jul 2021Artículo vendido;desde Estados Unidos;
Prince of Persia (Nintendo Game Boy, 1992) Completo En Caja;30,29 EUR;+ 4,23 EUR de envío;Vendidos  29 jul 2021Artículo vendido;desde Estados Unidos;
Prince of Persia Las Arenas de tiempo de juego Boy Advance probado y de trabajo;12,69 EUR;Envío gratis;Vendidos  27 jul 2021Artículo vendido;desde Estados Unidos;
Prince of Persia: las Arenas de tiempo de juego Boy Advance, Game _ boy _ Advanc Video Juegos;38,66 EUR;Envío gratis;Vendidos  24 jul 2021Artículo vendido;desde Estados Unidos;
Game Boy Advance Prince of Persia Las Arenas De Tiempo Gameboy GBA;21,14 EUR;+ 7,61 EUR de envío;Vendidos  20 jul 2021Artículo vendido;desde Estados Unidos;
Prince of Persia Gris (Nintendo Gameboy GB) solo carro gran forma;17,76 EUR;Envío gratis;Vendidos  16 jul 2021Artículo vendido;desde Estados Unidos;
Prince of Persia: The Sands of Time (Nintendo Game Boy Advance) GBA Authentic;10,68 EUR;+ 10,01 EUR de envío;Vendidos  15 jul 2021Artículo vendido;desde Canadá;
Prince of Persia: las Arenas de tiempo de juego Boy Advance * AUTÉNTICO *;11,84 EUR;Envío gratis;Vendidos  11 jul 2021Artículo vendido;desde Estados Unidos;
Prince of Persia Nintendo Game Boy Color Juego;16,03 EUR;+ 2,50 EUR de envío;Vendidos  9 jul 2021Artículo vendido;desde Estados Unidos;
Prince of Persia (Nintendo Game Boy, 1992) Completo En Caja;33,84 EUR;Envío gratis;Vendidos  8 jul 2021Artículo vendido;desde Estados Unidos;
Prince of Persia: las Arenas De Tiempo Nintendo Gameboy Advance Cartucho;8,03 EUR;Envío gratis;Vendidos  5 jul 2021Artículo vendido;desde Estados Unidos;
Prince of Persia-Gameboy-auténtico-solo Carro-Probado-Envío Gratuito;9,34 EUR;Envío gratis;Vendidos  1 jul 2021Artículo vendido;desde Estados Unidos;
Prince of Persia (Nintendo Game Boy, 1992) liberado y probado!;12,68 EUR;Envío gratis;Vendidos  30 jun 2021Artículo vendido;desde Estados Unidos;
Prince of Persia: las Arenas De Tiempo (Nintendo Game Boy Advance, 2003) GBA;10,99 EUR;Envío gratis;Vendidos  30 jun 2021Artículo vendido;desde Estados Unidos;
Prince of Persia: las Arenas De Tiempo (Nintendo Game Boy Advance, 2003);6,76 EUR;+ 3,51 EUR de envío;Vendidos  27 jun 2021Art��culo vendido;desde Estados Unidos;
Prince of Persia: las Arenas de tiempo de juego Boy Advance * AUTÉNTICO *;12,67 EUR;Envío gratis;Vendidos  22 jun 2021Artículo vendido;desde Estados Unidos;
Prince of Persia: las Arenas De Tiempo Nintendo Game Boy Advance Nuevo Sellado;63,46 EUR;Envío gratis;Vendidos  19 jun 2021Artículo vendido;desde Estados Unidos;
Prince of Persia 1990 PC Juego de MS-DOS Broderbund 3.5" y 51/4" disquetes de menta;152,10 EUR;+ 23,27 EUR de envío estimado;Vendidos  18 jul 2021Artículo vendido;desde Reino Unido;
Prince of Persia Super Nintendo SNES juego Game retro Gaming rare/72;19,99 EUR;+ 5,00 EUR de envío;Vendidos  16 ago 2021Artículo vendido;desde Alemania;
Prince of Persia SNES juego completo con embalaje original y guía;39,99 EUR;+ 8,00 EUR de envío;Vendidos  9 ago 2021Artículo vendido;desde Alemania;
Prince of Persia de vídeo juego para Microsoft Xbox 360 PAL Totalmente Nuevo Y Sellado;29,24 EUR;+ 16,95 EUR de envío estimado;Vendidos  1 ago 2021Artículo vendido;desde Reino Unido;
Prince of Persia Las Arenas De Tiempo, pal, completa, NINTENDO GAMECUBE Juego;7,02 EUR;+ 11,70 EUR de envío;Vendidos  10 ago 2021Artículo vendido;desde Reino Unido;
Prince of Persia Las Arenas De Tiempo ~ Sony Playstation 2 PS2 juego ~ Ubisoft;3,22 EUR;+ 4,97 EUR de envío;Vendidos  10 jul 2021Artículo vendido;desde Reino Unido;
Prince of Persia GAME GEAR JUEGO-trabajo-sólo Juego-Envío Gratis;11,69 EUR;+ 16,64 EUR de envío estimado;Vendidos  17 jul 2021Artículo vendido;desde Reino Unido;
Paquete De Juegos PS1 PS2 N-GEN RACING Dead Ball Zone Prince of Persia Kingdom Hearts;17,54 EUR;+ 40,62 EUR de envío estimado;Vendidos  11 sep 2021Artículo vendido;desde Reino Unido;
Prince of Persia: el rey caído video juego para Nintendo DS Pal probado;9,35 EUR;+ 16,59 EUR de envío estimado;Vendidos  13 sep 2021Artículo vendido;desde Reino Unido;
Retro Sega Master Sistema Juego ~ Prince of Persia ~ Sin Manual;11,70 EUR;+ 20,73 EUR de envío estimado;Vendidos  18 jul 2021Artículo vendido;desde Reino Unido;
Prince of Persia-Sega Mega Drive juego solo carro (PAL);21,05 EUR;+ 19,73 EUR de envío estimado;Vendidos  22 ago 2021Artículo vendido;desde Reino Unido;
Prince of Persia: Warrior dentro de | Xbox | PAL | Excelente Estado | Libre P&P;2,91 EUR;+ 16,47 EUR de envío estimado;Vendidos  12 sep 2021Artículo vendido;desde Reino Unido;
Prince of Persia con Demo | Sega Mega CD | Completo | PAL;29,24 EUR;+ 16,95 EUR de envío estimado;Vendidos  23 jul 2021Artículo vendido;desde Reino Unido;
Super Nintendo-SNES-Prince of Persia 2-Embalaje original-Top-pal -;129,90 EUR;Envío no especificado;Vendidos  9 sep 2021Artículo vendido;desde Alemania;
Prince of Persia El Guerrero en PS2 COMPLETO PAL-Probado-PlayStation 2;8,18 EUR;+ 16,57 EUR de envío estimado;Vendidos  19 ago 2021Artículo vendido;desde Reino Unido;
