Go! Go! Tank Nintendo Juego Original Boy * limpiado & Probado *;10,13 EUR;Envío gratis;Vendidos  10 sep 2021Artículo vendido;desde Estados Unidos;
Go! Go! Tank Nintendo Gameboy Caja/Insertos/Bandeja/Bolsa con sólo!! Excelente Cond!;76,15 EUR;+ 6,98 EUR de envío;Vendidos  10 ago 2021Artículo vendido;desde Estados Unidos;
Go! Go! Tank Nintendo Juego Original Boy-Probado-Envío Gratuito;10,96 EUR;Envío gratis;Vendidos  9 ago 2021Artículo vendido;desde Estados Unidos;
Go! Go! Tank Nintendo Gameboy probado obras de juego copia de alquiler;16,91 EUR;Envío gratis;Vendidos  4 ago 2021Artículo vendido;desde Estados Unidos;
Original Nintendo Gameboy-Go! Go! Tank, probado y de trabajo;6,94 EUR;Envío gratis;Vendidos  18 jul 2021Artículo vendido;desde Estados Unidos;
1991 Go! Go! Tank Carro de juego Auténtico Original y Manual Para Nintendo Game Boy GB;4,22 EUR;+ 3,38 EUR de envío;Vendidos  7 jul 2021Artículo vendido;desde Estados Unidos;
