Monster Truck Wars Nintendo Game Boy juego módulo muy buen estado probado;7,99 EUR;+ 9,99 EUR de envío;Vendidos  13 sep 2021Artículo vendido;desde Alemania;
Monster Truck Wars-GAMEBOY Juego-PAL (EUR);15,11 EUR;+ 16,60 EUR de envío estimado;Vendidos  8 ago 2021Artículo vendido;desde Reino Unido;
Monster Truck Madness Nintendo Game Boy Advance * Divertido Juego De Niños *;4,66 EUR;Envío gratis;Vendidos  16 sep 2021Artículo vendido;desde Estados Unidos;
Monster Trucks Quad furia Doble Pack Nintendo Game Boy Advance Video Juego Carro;1,12 EUR;+ 3,23 EUR de envío;Vendidos  15 sep 2021Artículo vendido;desde Estados Unidos;
Monster Trucks/ATV: Quad Power Racing GAMEBOY ADVANCE SP Nintendo GBA 2 Juegos;6,82 EUR;+ 3,79 EUR de envío;Vendidos  11 sep 2021Artículo vendido;desde Estados Unidos;
Mayhem Monster Trucks 2005 GBA NIntendo Game Boy Advance probado y de trabajo;4,26 EUR;Envío gratis;Vendidos  10 sep 2021Artículo vendido;desde Estados Unidos;
Monster Truck Madness (Nintendo, Gameboy Advance) GBA CARTUCHO sólo probado;5,92 EUR;Envío gratis;Vendidos  7 sep 2021Artículo vendido;desde Estados Unidos;
Monster Trucks NINTENDO GAMEBOY ADVANCE SP GBA;6,82 EUR;+ 4,26 EUR de envío;Vendidos  5 sep 2021Artículo vendido;desde Estados Unidos;
USHRA Monster Truck guerras Nintendo Juego Original Boy * limpiado & Probado *;11,05 EUR;Envío gratis;Vendidos  1 sep 2021Artículo vendido;desde Estados Unidos;
Monster Trucks/Quad Desierto Furia NINTENDO GAME BOY ADVANCE SP GBA;5,11 EUR;Envío gratis;Vendidos  28 ago 2021Artículo vendido;desde Estados Unidos;
Monster Truck Madness Nintendo Game Boy Advance * Divertido Juego De Niños *;2,11 EUR;Envío gratis;Vendidos  26 ago 2021Artículo vendido;desde Estados Unidos;
Monster Trucks Mayhem (Nintendo, Gameboy Advance) GBA solo carro auténtico Probado;5,96 EUR;Envío gratis;Vendidos  21 ago 2021Artículo vendido;desde Estados Unidos;
Monster Truck Madness Nintendo Gameboy Advance (Cartridge only) ;12,31 EUR;+ 4,95 EUR de envío;Vendidos  15 ago 2021Artículo vendido;desde Australia;
2 Juegos en 1 doble valor: Monster Trucks & Quad Desierto Furia (Nintendo Game Boy;1,70 EUR;+ 2,27 EUR de envío;Vendidos  11 ago 2021Artículo vendido;desde Estados Unidos;
Monster Truck Wars * Juego Solo/Sharpie marca * (Nintendo Gameboy);5,96 EUR;Envío gratis;Vendidos  6 ago 2021Artículo vendido;desde Estados Unidos;
Monster Truck Wars (Nintendo Game Boy) juego funciona!;8,10 EUR;Envío gratis;Vendidos  2 ago 2021Artículo vendido;desde Estados Unidos;
Monster Truck Madness Nintendo Gameboy Advance Game Cartridge Only;5,81 EUR;+ 12,99 EUR de envío;Vendidos  30 jul 2021Artículo vendido;desde Australia;
Monster Truck Madness (Nintendo GameBoy Advance) GBA CARTUCHO sólo probado;7,66 EUR;Envío gratis;Vendidos  20 jul 2021Artículo vendido;desde Estados Unidos;
Monster Truck Madness (Nintendo Game Boy Advance, 2003) probado! gran Juego! 🔥 🔥;4,69 EUR;Envío gratis;Vendidos  18 jul 2021Artículo vendido;desde Estados Unidos;
Monster Trucks Majesco Nintendo Game Boy Advance Exmt + Caja N Completa!;7,24 EUR;Envío gratis;Vendidos  10 jul 2021Artículo vendido;desde Estados Unidos;
Monster Trucks NINTENDO GAMEBOY ADVANCE SP GBA auténtico Probado;1,49 EUR;+ 2,72 EUR de envío;Vendidos  9 jul 2021Artículo vendido;desde Estados Unidos;
⭐⭐ Nuevo/Sellado ⭐⭐ Monster Truck Madness-GAMEBOY ADVANCE GBA ⭐⭐⭐⭐⭐⭐⭐⭐⭐⭐⭐⭐⭐⭐⭐⭐⭐;18,55 EUR;Envío gratis;Vendidos  8 jul 2021Artículo vendido;desde Estados Unidos;
Monster Truck Madness Gameboy Advance Solo Manual De Instrucciones;2,55 EUR;+ 1,70 EUR de envío;Vendidos  4 jul 2021Artículo vendido;desde Estados Unidos;
Monster Truck Madness 2-Caja Grande PC CD ROM Juego-Microsoft;23,20 EUR;+ 16,75 EUR de envío estimado;Vendidos  24 ago 2021Artículo vendido;desde Reino Unido;
Monster Truck Wars Game Gear Gamegear PAL;99,95 EUR;+ 19,95 EUR de envío;Vendidos  1 jul 2021Artículo vendido;desde España;
15 Monster Truck Coche Fiesta de Cumpleaños Cupcake Toppers Torta 4x4 coches Hot Wheels Niño;4,41 EUR;+ 4,01 EUR de envío;Vendidos  19 sep 2021Artículo vendido;desde Reino Unido;
Boy's Divertido Azul Monster Truck "edad 7" tarjeta de cumpleaños;1,15 EUR;+ 16,34 EUR de envío estimado;Vendidos  22 sep 2021Artículo vendido;desde Reino Unido;
Control remoto RC coche Truggy Buggy Monster Truck 2.4Ghz 12kph carreras de alta velocidad;17,43 EUR;+ 26,11 EUR de envío estimado;Vendidos  21 sep 2021Artículo vendido;desde Reino Unido;
Monster Truck Personalizado Pared Adhesivo Calcomanía Para Dormitorio De Niños Niño Arte de Mural;33,71 EUR;+ 21,62 EUR de envío estimado;Vendidos  26 jul 2021Artículo vendido;desde Reino Unido;
Chicos Personalizado Monster Truck 5th Cumpleaños Niño T-Shirt;10,45 EUR;+ 21,20 EUR de envío estimado;Vendidos  14 ago 2021Artículo vendido;desde Reino Unido;
Cumpleaños Niño Monster Truck 3 T-Shirt;9,25 EUR;+ 16,49 EUR de envío estimado;Vendidos  16 jul 2021Artículo vendido;desde Reino Unido;
Chicos Personalizado Azul Monster Truck 1st, 2nd, 3rd, 4th, 5th Cumpleaños Niño T-Shirt;10,45 EUR;+ 21,20 EUR de envío estimado;Vendidos  11 sep 2021Artículo vendido;desde Reino Unido;
