Bionic Battler-GAMEBOY Juego;22,25 EUR;+ 16,85 EUR de envío estimado;desde Reino Unido;
Bionic Battler Nintendo Game Boy Cartucho y Manual Caja Cartucho en caja auténtica Gameboy;118,42 EUR;+ 6,34 EUR de envío;desde Estados Unidos;
Bionic Battler Nintendo Game boy caja sólo;84,58 EUR;+ 4,22 EUR de envío;desde Estados Unidos;
Bionic Battler Nintendo Game Boy Juego De Video Con Estuche Transparente-GB RARO DMG-vs-EE. UU.;15,99 EUR;+ 4,19 EUR de envío;desde Estados Unidos;
Bionic Battler Game Boy 1992 ANUNCIO IMPRESO DE COLECCIÓN/arte cartel Auténtico Oficial Raro;12,68 EUR;Envío gratis;desde Estados Unidos;
Bionic Battler Nintendo Game Boy Color Juego;12,68 EUR;Envío gratis;desde Estados Unidos;
Bionic Battler Nintendo Game Boy Solo Manual Leer;25,34 EUR;+ 4,74 EUR de envío;desde Estados Unidos;
Bionic Battler (Nintendo Game Boy, 1992) Cartridge Only;8,61 EUR;+ 7,78 EUR de envío;desde Canadá;
Bionic Battler (Nintendo Game Boy) Auténtico cartucho sólo;15,23 EUR;Envío gratis;desde Estados Unidos;
Bionic Battler (Nintendo Game Boy) Cart Only ;11,31 EUR;+ 10,01 EUR de envío;desde Canadá;
Nuevo anuncioBionic Battler para Nintendo GameBoy-Probado Y Funcionando!;16,91 EUR;+ 3,76 EUR de envío;desde Estados Unidos;
Juegos Niño Bionic Battler;16,92 EUR;desde Estados Unidos;
