Gameboy -- College Slam -- DMG-ANYE-USA -- Instruction Manual;4,99 EUR;Envío no especificado;desde Países Bajos;
College Slam Nintendo Game Boy;5,47 EUR;+ 3,34 EUR de envío;desde Estados Unidos;
GB-College Slam Nintendo Game Boy 1996 solo carro;10,90 EUR;Envío gratis;desde Estados Unidos;
Lote De Tres 3 Game Boy Juegos caza del Octubre Rojo College Slam Olímpicos Invierno;15,15 EUR;Envío gratis;desde Estados Unidos;
College Slam-Nintendo Game Boy Auténtico-Color;9,23 EUR;Envío gratis;desde Estados Unidos;
College Slam Original NINTENDO GAMEBOY Juego Probado Funcionando auténtico!;10,99 EUR;Envío gratis;desde Estados Unidos;
College Slam (Nintendo Game Boy) * Juego Solo Carro-limpiado & Probado *;9,89 EUR;Envío gratis;desde Estados Unidos;
NBA Jam & College Slam auténtico (Nintendo Game Boy) Juegos de Baloncesto;14,58 EUR;Envío gratis;desde Estados Unidos;
Lote de 2 Disneys Libro De La Selva + College Slam Nintendo Game Boy con casos;12,69 EUR;Envío gratis;desde Estados Unidos;
College Slam-Nintendo Game Boy Video Juego-solo carro;6,73 EUR;+ 2,50 EUR de envío;desde Estados Unidos;
College Slam (Nintendo Game Boy, 1996) Auténtico probado propiedad de un adulto Envío Gratis;10,99 EUR;Envío gratis;desde Estados Unidos;
College Slam CON MANUAL NINTENDO GAMEBOY Juego Probado Funcionando auténtico!;12,94 EUR;Envío gratis;desde Estados Unidos;
College Slam og Nintendo GB Game Boy GameBoy GBA SP juego solo carro Auténtico;11,56 EUR;Envío gratis;desde Estados Unidos;
College Slam (Nintendo Game Boy, 1996);6,34 EUR;+ 3,76 EUR de envío;desde Estados Unidos;
Game Boy College Slam;211,48 EUR;+ 16,92 EUR de envío;desde México;
College Slam Original NINTENDO GAMEBOY Juego Probado Funcionando auténtico!;10,99 EUR;Envío gratis;desde Estados Unidos;
1991 Nintendo Gameboy College Slam Folleto de instrucciones;7,99 EUR;+ 3,60 EUR de envío;desde Estados Unidos;
College Slam Original NINTENDO GAMEBOY Juego;10,91 EUR;Envío gratis;desde Estados Unidos;
