Gameboy Boulder Dash en caja con instrucciones;45,70 EUR;+ 31,51 EUR de envío estimado;Vendidos  12 sep 2021Artículo vendido;desde Reino Unido;
Nintendo Game Boy Classic juego Boulder Dash con embalaje original y guía Noe;64,90 EUR;+ 8,99 EUR de envío;Vendidos  17 ago 2021Artículo vendido;desde Alemania;
Juego Boulder Dash. Nintendo Game boy advance.;14,95 EUR;Envío no especificado;Vendidos  6 jul 2021Artículo vendido;desde España;
Vintage Nintendo Game Boy Juego. Boulder Dash.;8,79 EUR;+ 17,89 EUR de envío estimado;Vendidos  2 jul 2021Artículo vendido;desde Reino Unido;
Nintendo Game Boy Boulder Dash  GameBoy avec Notice Vers. FAH ;17,00 EUR;Envío no especificado;Vendidos  20 jun 2021Artículo vendido;desde Francia;
Boulder Dash Ex (Nintendo Game Boy Advance, 2002) solo carro;16,06 EUR;+ 3,38 EUR de envío;Vendidos  24 ago 2021Artículo vendido;desde Estados Unidos;
Boulder Dash Ex (Nintendo Game Boy Advance, 2002) Completo en Caja (Completo en Caja);43,14 EUR;+ 3,38 EUR de envío;Vendidos  23 ago 2021Artículo vendido;desde Estados Unidos;
Boulder Dash Ex (Nintendo Game Boy Advance, 2002) 100% Genuino Manual Incluido;24,52 EUR;Envío gratis;Vendidos  6 ago 2021Artículo vendido;desde Estados Unidos;
Boulder Dash EX (Nintendo GameBoy Advance GBA) [Complete in Box CIB];44,04 EUR;+ 7,97 EUR de envío;Vendidos  26 jul 2021Artículo vendido;desde Canadá;
Boulder Dash Ex (Nintendo Game Boy Advance, 2002) 100% Genuino;22,07 EUR;Envío gratis;Vendidos  20 jun 2021Artículo vendido;desde Estados Unidos;
Boulder Dash-Commodore c64/128 - Game;22,00 EUR;+ 5,00 EUR de envío;Vendidos  28 jun 2021Artículo vendido;desde Alemania;
Nintendo DS-Juego de rocas Boulder Dash;1,16 EUR;+ 33,03 EUR de envío estimado;Vendidos  22 ago 2021Artículo vendido;desde Reino Unido;
Boulder Dash-XL 3D Juego Nuevo Sellado Nintendo 3DS Dash XL Diamante Rompecabezas;8,78 EUR;+ 33,18 EUR de envío estimado;Vendidos  9 jul 2021Artículo vendido;desde Reino Unido;
Nintendo NES Juego-Boulder Dash;12,83 EUR;+ 16,67 EUR de envío estimado;Vendidos  7 jul 2021Artículo vendido;desde Reino Unido;
Nintendo DS-Boulder Dash Rocks! - Game-clásico rompecabezas;9,49 EUR;+ 41,99 EUR de envío;Vendidos  31 ago 2021Artículo vendido;desde Alemania;
Boulder Dash XL PC DVD Juego De Puzzle;8,19 EUR;+ 18,94 EUR de envío estimado;Vendidos  10 jul 2021Artículo vendido;desde Reino Unido;
