Nintendo Gameboy-Cool World-Embalaje original-us-raras;899,90 EUR;Envío no especificado;desde Alemania;
Gameboy Cool World USA Box Only - Nintendo GameBoy - NGB - offers welcome;349,95 EUR;+ 19,95 EUR de envío;desde Países Bajos;
Cool World (Super Nintendo Entertainment sistema, 1993);92,20 EUR;+ 11,00 EUR de envío;desde Grecia;
Nintendo Gameboy Classic Cool World EE. UU.;180,00 EUR;Envío no especificado;desde Alemania;
SNES Cool World Video Juego Cartucho auténtico, probado funciona!;17,76 EUR;Envío gratis;desde Estados Unidos;
Cool World-Original Nintendo SNES Juego;18,60 EUR;+ 2,50 EUR de envío;desde Estados Unidos;
Cool World (Nintendo Game Boy, 1992) GB;40,04 EUR;+ 5,34 EUR de envío;desde Canadá;
Cool World (Super Nintendo SNES) * Nueva-Sellado De Fábrica-Lágrimas *;532,92 EUR;Envío gratis;desde Estados Unidos;
SNES Cool World Video Juego Cartucho sólo auténtico, juego;12,69 EUR;+ 4,23 EUR de envío;desde Estados Unidos;
Game Boy - Cool World - Cartridge Only - TESTED;46,71 EUR;+ 13,35 EUR de envío;desde Canadá;
Cool World Super Nintendo Video Juego Y Caja;33,83 EUR;Envío gratis;desde Estados Unidos;
Cool World (Super Nintendo Entertainment sistema, 1993) alquiler anterior Raro;50,75 EUR;+ 4,74 EUR de envío;desde Estados Unidos;
Cool World (Super Nintendo Entertainment sistema, 1993) muy buena no las instrucciones;44,62 EUR;Envío gratis;desde Estados Unidos;
Cool World [e] solo carro;25,33 EUR;Envío gratis;desde Estados Unidos;
Cool World (Super Nintendo Entertainment sistema, 1993);15,22 EUR;+ 3,34 EUR de envío;desde Estados Unidos;
SUPER NINTENDO SNES-Cool World rara y única adición a su colección!;101,50 EUR;+ 4,22 EUR de envío;desde Estados Unidos;
