The Blues Brothers para NINTENDO GAME BOY CARTUCHO sólo Genuino!;11,71 EUR;+ 19,91 EUR de envío;desde Reino Unido;
The Blues Brothers Jukebox aventuras juego Boy juego;17,58 EUR;+ 20,87 EUR de envío estimado;desde Reino Unido;
The Blues Brothers - Jukebox Adventure |Game Boy 🕹 Very Good Condition ;15,00 EUR;+ 3,50 EUR de envío;desde Países Bajos;
The Blues Brothers Nintendo Game Boy GB PAL ITA GIG Usato Completo Titus ;199,90 EUR;Envío no especificado;desde Italia;
The Blues Brothers Jukebox Aventura Nintendo Game Boy Cartucho Original;23,42 EUR;+ 16,87 EUR de envío estimado;desde Reino Unido;
Nintendo Game Boy The Blues Brothers FRG Très Bon état;19,90 EUR;+ 11,98 EUR de envío;desde Francia;
The Blues Brothers - Jukebox Adventures - FRG - Nintendo Gameboy Classic;99,00 EUR;+ 25,00 EUR de envío;desde Países Bajos;
The Blues Brothers Nintendo Gameboy Juego + Manual;17,56 EUR;+ 19,05 EUR de envío estimado;desde Reino Unido;
The Blues Brothers GameBoy Original Nintendo Cartucho PAL;17,56 EUR;+ 16,77 EUR de envío estimado;desde Reino Unido;
The Blues Brothers Jukebox Aventuras (Nintendo Gameboy) Solo Carro. Gratis P + P.;15,10 EUR;+ 16,72 EUR de envío estimado;desde Reino Unido;
The Blues Brothers Jukebox Adventure Game Boy;16,99 EUR;+ 39,00 EUR de envío;desde Italia;
Nintendo Gameboy Juego-The Blues Brothers;17,52 EUR;+ 16,77 EUR de envío estimado;desde Reino Unido;
The Blues Brothers-Jukebox Adventures-frg-Nintendo Gameboy juego/módulo.;35,00 EUR;+ 5,90 EUR de envío;desde Alemania;
The Blues Brothers-Nintendo Game Boy Gratis 1st Class Post;23,38 EUR;+ 12,30 EUR de envío;desde Reino Unido;
The Blues Brothers Gameboy;15,23 EUR;+ 17,88 EUR de envío estimado;desde Reino Unido;
Nintendo Game Boy - The Blues Brothers - PAL - FAH;19,99 EUR;+ 5,00 EUR de envío;desde Francia;
Nintendo gb/Gameboy-The Blues Brothers-solo módulo/only Cartridge;10,00 EUR;+ 25,00 EUR de envío;desde Alemania;
Nintendo Game Boy The Blues Brothers Notice / Instruction Manual;12,99 EUR;+ 2,75 EUR de envío;desde Francia;
The Blues Brothers-Raro Nintendo Gameboy Juego con Estuche Oficial;18,75 EUR;+ 5,86 EUR de envío;desde Reino Unido;
The Blues Brothers - Nintendo Gameboy Spiel Game Retro - mit OVP und Anleitung;16,50 EUR;Envío no especificado;desde Austria;
The Blues Brothers FRG - Nintendo GameBoy - NGB;31,45 EUR;+ 19,95 EUR de envío;desde Países Bajos;
The Blues Brothers: Jukebox Adventure - Nintendo GameBoy - NGB;17,95 EUR;+ 19,95 EUR de envío;desde Países Bajos;
The Blues Brothers (losse cassette) nintendo gameboy gb;6,97 EUR;+ 20,00 EUR de envío;desde Países Bajos;
The Blues Brothers (slechte sticker, losse cassette) nintendo gameboy gb;5,25 EUR;+ 20,00 EUR de envío;desde Países Bajos;
Nintendo Gameboy Game - The Blues Brothers (UKV);14,95 EUR;+ 5,00 EUR de envío;desde Países Bajos;
The Blues Brothers Nintendo Game Boy Italiano Gig Titus Raro Full Boxed;359,00 EUR;Envío no especificado;desde Italia;
Nintendo Game Boy The Blues Brothers  GameBoy  Vers. UKV;14,90 EUR;Envío no especificado;desde Francia;
The Blues Brothers-Gameboy - 100% Auténticos Noe-Completo En Caja-raro-MBC-lea a continuación;146,47 EUR;Envío no especificado;desde Reino Unido;
Nintendo Game Boy The Blues Brothers  GameBoy  Vers .FAH;12,00 EUR;Envío no especificado;desde Francia;
The Blues Brothers: Jukebox Adventures Gameboy OVP;110,00 EUR;Envío no especificado;desde Alemania;
The Blues Brothers: Jukebox Adventures | Nintendo Game Boy juego | Gameboy Class;22,19 EUR;Envío no especificado;desde Alemania;
The Blues Brothers: Jukebox Adventures | Nintendo Game Boy juego | Gameboy Class;18,99 EUR;Envío no especificado;desde Alemania;
