The Bugs Bunny Crazy Castle 2 | Nintendo Gameboy | módulo | ** como nuevo! **;18,49 EUR;Envío no especificado;Vendidos  24 ago 2021Artículo vendido;desde Alemania;
The Bugs Bunny Crazy Castle + boitier NINTENDO GAME BOY (FAH) très bon état ;9,90 EUR;+ 9,00 EUR de envío;Vendidos  22 ago 2021Artículo vendido;desde Francia;
Jeu / Game NINTENDO GAME BOY (FAH) The Bugs Bunny Crazy Castle 1990 + Étui Case;11,50 EUR;+ 3,00 EUR de envío;Vendidos  31 jul 2021Artículo vendido;desde Francia;
The Bugs Bunny Crazy Castle sur Gameboy et Gameboy Advance !!!!;6,49 EUR;+ 5,49 EUR de envío;Vendidos  23 jul 2021Artículo vendido;desde Francia;
Nintendo Gameboy Pocket Con The Bugs Bunny Crazy Castle 2 Negro;33,84 EUR;Envío gratis;Vendidos  30 ago 2021Artículo vendido;desde Estados Unidos;
The Bugs Bunny Crazy Castle (Nintendo Game Boy) Authentic Original Gameboy;6,65 EUR;+ 9,99 EUR de envío;Vendidos  18 jul 2021Artículo vendido;desde Canadá;
Nintendo Gameboy The Bugs Bunny Crazy Castle (Cartridge Only);2,37 EUR;+ 10,68 EUR de envío;Vendidos  4 jul 2021Artículo vendido;desde Canadá;
Nintendo NES NTSC USA-C1-USA - The Bugs Bunny Crazy Castle;23,38 EUR;+ 16,87 EUR de envío estimado;Vendidos  25 jun 2021Artículo vendido;desde Reino Unido;
