Pinball Deluxe Para Nintendo Game Boy Con Estuche Oficial;14,03 EUR;+ 16,67 EUR de envío estimado;desde Reino Unido;
Nintendo Game Boy-Pinball Deluxe-Top-Embalaje original-Pal;79,90 EUR;Envío no especificado;desde Alemania;
Pinball Deluxe-Nintendo Gameboy-Cartucho únicamente;10,52 EUR;+ 16,61 EUR de envío estimado;desde Reino Unido;
Nintendo Gameboy En Caja Juego De Pinball Deluxe;45,23 EUR;+ 17,25 EUR de envío estimado;desde Reino Unido;
Tetris Y Pinball Deluxe Gameboy Juegos Sin Caja;15,21 EUR;+ 17,46 EUR de envío estimado;desde Reino Unido;
Nintendo Gameboy-Pinball Deluxe;13,98 EUR;+ 16,67 EUR de envío estimado;desde Reino Unido;
Pinball Deluxe para Nintendo GameBoy;12,99 EUR;+ 9,99 EUR de envío;desde Alemania;
Raro Gameboy Pinball Deluxe Game-totalmente probado y funcionando Juego Boy juego;23,39 EUR;+ 17,97 EUR de envío estimado;desde Reino Unido;
Notice / Booklet - Pinball Deluxe - EUR-1 - Game Boy - No Annotation;6,00 EUR;Envío no especificado;desde Francia;
Pinball & Pinball Deluxe Lote de 2 Juegos originales auténticos Nintendo Game Boy;12,65 EUR;+ 3,38 EUR de envío;desde Estados Unidos;
Pinball Deluxe - EUR - Nintendo Gameboy;60,00 EUR;+ 25,00 EUR de envío;desde Países Bajos;
Pinball Deluxe Gametek Gameboy Game Boy GB GBC GBA Nintendo EUR cartucho sólo;26,10 EUR;Envío internacional gratis;desde Francia;
Nintendo Gameboy GB GBC GBA SP - Pinball Deluxe;99,95 EUR;+ 31,80 EUR de envío;desde Países Bajos;
Pinball Deluxe (losse cassette) nintendo gameboy gb;10,46 EUR;+ 20,00 EUR de envío;desde Países Bajos;
Gameboy DMG-01 Pinball Deluxe Nintendo *** COMPLETE CIB *** DMG-APDP-EUR;60,00 EUR;+ 14,50 EUR de envío;desde Bélgica;
